{
  "schemaVersion": 2,
  "purpose": "dobby.plugin-package",
  "pluginId": "com.dobby.sample",
  "version": "1.0.0",
  "vendorId": "dobby.dev-qa",
  "hostApiVersion": "2.0",
  "minHostVersion": "1.0.0",
  "entryAssembly": "bin/plugins/Dobby.Sample.Plugin.dll",
  "displayName": "Dobby Sample",
  "description": "Dev and QA plugin verification artifact for Dobby host/plugin boundaries.",
  "icon": {
    "path": "assets/sample-plugin.png"
  },
  "dependsOn": [],
  "capabilities": [
    {
      "name": "plugin-page",
      "scope": "plugin-page"
    }
  ],
  "operationTargets": [
    {
      "id": "com.dobby.sample.greet",
      "verbs": [
        "execute"
      ],
      "labelKey": "sample.greet.label"
    }
  ],
  "extensionPoints": [
    {
      "id": "sample.root",
      "target": "top-toolbar",
      "routeKey": "sample",
      "labelKey": "sample.nav.root",
      "group": "default",
      "weight": 100
    },
    {
      "id": "sample.greet.page",
      "target": "sidebar",
      "parentId": "sample.root",
      "routeKey": "greet",
      "labelKey": "sample.nav.greet",
      "group": "default",
      "weight": 100
    }
  ],
  "files": [
    {
      "path": "assets/sample-plugin.png",
      "sha256": "09674a3e53a60e8cdcd210b1b0e48b2386c1ce3f3c909af3752872dae2d41db8"
    },
    {
      "path": "bin/plugins/Dobby.Sample.Plugin.dll",
      "sha256": "ffffffffffffffffffffffffffffffffffffffffffffffffffffffffffffffff"
    }
  ],
  "signature": {
    "purpose": "dobby.plugin-package",
    "algorithm": "ECDSA-P256-SHA256",
    "format": "IeeeP1363FixedFieldConcatenation",
    "keyId": "plugin-test-2026-01",
    "value": "______________________________________________________________________________________"
  }
}
